{"$schema":"https://json-schema.org/draft/2020-12/schema","$id":"https://digitalactionreceipts.com/schemas/dar-codex-evidence-1.0.json","type":"object","additionalProperties":false,"required":["manifest_version","starting_state","authorized_scope","prohibited_actions","required_human_approvals","acceptance_criteria","events","security_checks","generated_commits","ci_evidence","final_outcome","evidence_digest"],"properties":{"manifest_version":{"const":"dar-codex-instrumentation-1.0"},"starting_state":{"type":"object"},"authorized_scope":{"type":"array","minItems":1,"maxItems":16,"items":{"type":"string","maxLength":512}},"prohibited_actions":{"type":"array","minItems":1,"maxItems":16,"items":{"type":"string","maxLength":128}},"required_human_approvals":{"type":"array","minItems":1,"maxItems":8,"items":{"type":"string","maxLength":512}},"acceptance_criteria":{"type":"array","minItems":1,"maxItems":16,"items":{"type":"string","maxLength":512}},"events":{"type":"array","maxItems":256,"items":{"type":"object","additionalProperties":false,"required":["kind","status","detail"],"properties":{"kind":{"enum":["command","change","test","security_check","ci","outcome"]},"status":{"type":"string","maxLength":512},"detail":{"type":"string","maxLength":512},"command":{"type":"string","maxLength":512},"path":{"type":"string","maxLength":512},"sha":{"type":"string","maxLength":512}}}},"security_checks":{"type":"array","maxItems":64,"items":{"type":"object","required":["name","status","detail"],"properties":{"name":{"type":"string","maxLength":512},"status":{"type":"string","maxLength":512},"detail":{"type":"string","maxLength":512}}}},"generated_commits":{"type":"array","maxItems":32,"items":{"type":"object","required":["sha","message"],"properties":{"sha":{"type":"string","maxLength":512},"message":{"type":"string","maxLength":512}}}},"ci_evidence":{"type":"array","maxItems":64,"items":{"type":"object","required":["name","status","detail"],"properties":{"name":{"type":"string","maxLength":512},"status":{"type":"string","maxLength":512},"detail":{"type":"string","maxLength":512}}}},"final_outcome":{"enum":["complete","blocked","in_progress"]},"evidence_digest":{"type":"string","pattern":"^[A-Za-z0-9_-]{43}$"}}}
